<!ELEMENT menu (item+)>
<!ELEMENT item (name, description, price)>
<!ELEMENT name (#PCDATA)>
<!ELEMENT description (#PCDATA)>
<!ELEMENT price (#PCDATA)>
